"page","diagram_number","players","year","solution_move","solution_move_with_notation","solution_full_move","solution_full_text","solution_turn","fen","api_turn","image_path","image_page","header_page","solution_page"
"518","706","Anand - Cubillo Munoz","2007","f5","f5!","21... f5!","21...f5!³ Defending against the two big threats of Bh6 and Nde4. 22.Nde4! Berg correctly judged this to be White’s best try nevertheless, but the complications were safe enough for Black. 22...fxe4 23.Nxe4 Rxf1+ 24.Rxf1 Qc7 25.Qg4? 25.Nd6! Ba7 26.Qh3 Qd7 27.Rf7 Qxf7 28.Nxf7 Kxf7 29.Qxh7 would have given White counterplay against the king, and a draw seems the most likely outcome. 25...Qxe5 26.Qh5 h6!-+ White’s attack was dead in the water.","black","","","data_output/extracted_images/diagram_638_page_520.png","520","518","520"
"519","707","Carlsen - Morozevich","2007","f5","f5!","21... f5!","21...f5!³ Defending against the two big threats of Bh6 and Nde4. 22.Nde4! Berg correctly judged this to be White’s best try nevertheless, but the complications were safe enough for Black. 22...fxe4 23.Nxe4 Rxf1+ 24.Rxf1 Qc7 25.Qg4? 25.Nd6! Ba7 26.Qh3 Qd7 27.Rf7 Qxf7 28.Nxf7 Kxf7 29.Qxh7 would have given White counterplay against the king, and a draw seems the most likely outcome. 25...Qxe5 26.Qh5 h6!-+ White’s attack was dead in the water.","black","","","data_output/extracted_images/diagram_639_page_520.png","520","519","520"
"519","708","Berg - Topalov","2008","f5","f5!","21... f5!","21...f5!³ Defending against the two big threats of Bh6 and Nde4. 22.Nde4! Berg correctly judged this to be White’s best try nevertheless, but the complications were safe enough for Black. 22...fxe4 23.Nxe4 Rxf1+ 24.Rxf1 Qc7 25.Qg4? 25.Nd6! Ba7 26.Qh3 Qd7 27.Rf7 Qxf7 28.Nxf7 Kxf7 29.Qxh7 would have given White counterplay against the king, and a draw seems the most likely outcome. 25...Qxe5 26.Qh5 h6!-+ White’s attack was dead in the water.","black","","","data_output/extracted_images/diagram_640_page_520.png","520","519","520"
"520","709","Anand - Karjakin","2009","Bd8","Bd8!","22... Bd8!","22...Bd8! Preparing to exchange the passive bishop, gaining control over the d4-square. At the same time Black defends the queen and thus prepares ...b5xc4. 23.cxb5 axb5 24.Bd3 Bb6= 24...b4?! 25.Qb3 Bb6 26.Rxb4+/- was the game.","black","","","data_output/extracted_images/diagram_641_page_520.png","520","520","521"
"521","710","Mamedyarov - Anand","2009","d5","d5!","17. d5!","17.d5! Otherwise White is simply worse with a weak pawn on e3, in addition to Black’s bishop pair. 17...exd5 18.Bxd5 No more bishop pair. 18...Bxd5 19.Rfd1= Both players have weak pawns, and the knight on d5 is not enough to claim an advantage. 19.Rcd1 was Mamedyarov’s choice.","white","","","data_output/extracted_images/diagram_642_page_521.png","521","521","521"
"521","711","Khalifman - Topalov","2009","c4","c4","27... c4","27...c4 Exchanging an isolated pawn while activating the bishop and rooks. Black just needs to make sure that White doesn’t win on the eighth rank. 28.Rd8 28.bxc4? Rb2µ 28...Kg7!µ","black","","","data_output/extracted_images/diagram_643_page_522.png","522","521","522"
"522","712","Karjakin - Carlsen","2010","f6","f6!","18... f6!","18...f6! Attacking White’s centre, which is insufficiently defended. 18...Nb6?! goes immediately for the c4-square, but 19.Bd3 h6? 20.f5 gives White a winning attack. Black needs to address the kingside first. 19.exf6 19.Bd3?! h6 only increases White’s problems with the rook stuck on d4.","black","","","data_output/extracted_images/diagram_644_page_522.png","522","522","522"
"523","713","Anand - Ivanchuk","2010","Qb6","Qb6","17... Qb6","17...Qb6 With the queens exchanged, Black’s king would be able to walk to e7, defending the d- pawn. 18.Qd2 Black has now activated the queen for free. 18...Rfd8 ...and the game goes on.","black","","","data_output/extracted_images/diagram_645_page_523.png","523","523","523"
"523","714","Hammer - Carlsen","2010","h3","h3!","26... h3!","26...h3! White has no light-squared bishop, so it’s logical that Carlsen weakens the pawn on f3. 27.Nde2 hxg2 28.Kxg2³ Hammer misses his light-squared bishop. At the press conference before the tournament, Carlsen was asked whether he could possibly lose against Hammer. He answered that he was celebrating ten unbeaten years against his friend, rapids included. Well, later in the game Hammer got a decisive king’s attack and won - on the light squares! The outcome of chess games is not always logical.","black","","","data_output/extracted_images/diagram_646_page_523.png","523","523","524"
"524","715","Carlsen - Polgar","2010","a6","a6!","15. a6!","15.a6! Bc6 15...bxc4 16.axb7 Rab8 17.Bxc4 Rxb7+/- White has the bishop pair and the a-pawn is chronically weak. 15...Bc8 16.Ne3 Black is forced to weaken the light squares with ...b5-b4, either now or on the next move. The pawn on a6 is an asset, and the knight can move forward instead of retreating: 16.Na5²","white","","","data_output/extracted_images/diagram_647_page_524.png","524","524","524"
"524","716","Carlsen - Short","2010","Nb6","Nb6!","20. Nb6!","20.Nb6! Keeping Black’s bishop on c8 is worth more than losing the bishop pair. 20.Rxd5 exd5 21.Nb6 Rb8 22.Bf4 is not winning material due to: 22...Bc5!= 20...Nxe3 20...Nxb6 21.Bxb6+- 21.fxe3 Rb8+- To develop the bishop, Black needs to go ...e6-e5, which allows the rook to snatch a pawn with Rd5xa5.","white","","","data_output/extracted_images/diagram_648_page_525.png","525","524","525"
"525","717","Ponomariov - Carlsen","2011","Nc6","Nc6","13. Nc6","13.Nc6 Exchanging Black’s bishop and thus making it realistic to attack the d-pawn. 13...Bd8 The","white","","","data_output/extracted_images/diagram_649_page_525.png","525","525","525"
"526","718","Khalifman - Gabrielian","2011","d5","d5!","19... d5!","19...d5!-+ The bishop on b3 is killed forever. It moved five times between b3 and a2 before White resigned on move 44. According to Jacob Aagaard, this is “one of the greatest instructive games of history”.","black","","","data_output/extracted_images/diagram_650_page_527.png","527","526","527"
"526","719","Short - Kramnik","2011","d5","d5!","19... d5!","19...d5!-+ The bishop on b3 is killed forever. It moved five times between b3 and a2 before White resigned on move 44. According to Jacob Aagaard, this is “one of the greatest instructive games of history”.","black","","","data_output/extracted_images/diagram_651_page_527.png","527","526","527"
"527","720","Topalov - Karjakin","2013","h3","h3!","22... h3!","22...h3! 22...Qh8?! allowed 23.g4 Bd7 24.h3= in the game. 23.Bh1 Re8µ g3-g4 is not winning a piece, and the pawn on h3 is a potential winner in the middlegame as well as in the endgame.","black","","","data_output/extracted_images/diagram_652_page_527.png","527","527","527"
"528","721","Korobov - Topalov","2013","Nf5","Nf5!","18... Nf5!","18...Nf5!µ On the way towards e4, via either g3 or d6. White’s centre is more fragile than strong. After 18...Rfe8 19.Qf2 it would be too late to jump to f5.","black","","","data_output/extracted_images/diagram_653_page_528.png","528","528","528"
"528","722","Gelfand - Anand","2014","a4","a4","13... a4","13...a4 14.Qc2 a3³ The last two moves stopped White from kicking the bishop with a2-a3.","black","","","data_output/extracted_images/diagram_654_page_528.png","528","528","528"
"529","723","Navara - Topalov","2014","Rxc1","Rxc1!","21... Rxc1!","21...Rxc1! Diverting one of White’s pieces in order to push ...d4-d3. 22.Rxc1 22.Qxc1 allows 22...Rc8 followed by invading on c2. 22.Bxc1!? d3 23.h4! gives White chances to hold after exchanging some pawns and the queens, although Black is still thoroughly in control. 22...d3 23.Bxe5 23.Re1 Re7 does not change much. 23...Qxe5µ White will have a hard time controlling the passed pawn.","black","","","data_output/extracted_images/diagram_655_page_529.png","529","529","529"
"529","724","Carlsen - Anand","2014","d4","d4²","13. d4²","13.d4² Taking over the centre before Black has time to do so. If Black was to move then 13...d5! would be a good choice. 13...Qc7 14.Ra3!? The rook is developed without moving the bishop from c1. Many squares along the third rank could be interesting.","white","","","data_output/extracted_images/diagram_656_page_529.png","529","529","530"
"530","725","Anand - Nakamura","2015","Rb6","Rb6!","25. Rb6!","25.Rb6!+/- Using the outpost to threaten the c6-pawn. An exchange on b6 would give White a strong passed pawn.","white","","","data_output/extracted_images/diagram_657_page_531.png","531","530","531"
"530","726","Anand - Nakamura","2015","Rb6","Rb6!","25. Rb6!","25.Rb6!+/- Using the outpost to threaten the c6-pawn. An exchange on b6 would give White a strong passed pawn.","white","","","data_output/extracted_images/diagram_658_page_531.png","531","530","531"
"531","727","Anand - Carlsen","2015","f5","f5+/-","27. f5+/-","27.f5+/- Not giving Black the e5-square for the knight (by ...e5xf4). One idea for White is h3-h4, f5xg6, Be3 and h4-h5, finally getting the f5-square. Black can’t keep the position closed with 27...g5 because of: 28.h4+-","white","","","data_output/extracted_images/diagram_659_page_531.png","531","531","531"
"532","728","Gledura - Anand","2016","Bxf6","Bxf6!","31. Bxf6!","31.Bxf6! Exchanging the knight makes Black’s bishop a bad piece. White can put everything on the light squares. 31...Bxf6 32.Ke4 Bd8 33.Ne5 Ke7 34.Kd5 Bb6? Black can hold a draw with 34...Bc7! followed by further precise defence, but that doesn’t change the fact that 31.Bxf6 was the correct move. 35.Nd3 Kd7 36.Nc5+! Bxc5 Or 36...Kc7 37.Ne4 and White wins with f2-f3 followed by Nd6. 37.Kxc5 The pawn ending is winning, but that’s not for this book.","white","","","data_output/extracted_images/diagram_660_page_532.png","532","532","532"
"532","729","Kasparov - Caruana","2016","Bg4","Bg4!","11... Bg4!","11...Bg4!³ The pin is problematic for White; for instance, if 12.Qd2? Nxe4!-+ Black wins a pawn.","black","","","data_output/extracted_images/diagram_661_page_532.png","532","532","533"
"533","730","Kramnik - Sjugirov","2016","Qf4","Qf4","18. Qf4","18.Qf4 With Black having the weaker king, White should keep the queens on the board. 18.Qg3?! gives Black a change to activate the queen with ...Qe4. Winning a pawn with 18.Qxc6+ bxc6 19.Bxa7 is fruitless. Black has three weak pawns to put pressure on after 19...Kc7 18...b6 19.a4!‚","white","","","data_output/extracted_images/diagram_662_page_535.png","535","533","535"
"533","731","Topalov - Mamedyarov","2018","Qf4","Qf4","18. Qf4","18.Qf4 With Black having the weaker king, White should keep the queens on the board. 18.Qg3?! gives Black a change to activate the queen with ...Qe4. Winning a pawn with 18.Qxc6+ bxc6 19.Bxa7 is fruitless. Black has three weak pawns to put pressure on after 19...Kc7 18...b6 19.a4!‚","white","","","data_output/extracted_images/diagram_663_page_535.png","535","533","535"
"534","732","Carlsen - Wojtaszek","2018","Qf4","Qf4","18. Qf4","18.Qf4 With Black having the weaker king, White should keep the queens on the board. 18.Qg3?! gives Black a change to activate the queen with ...Qe4. Winning a pawn with 18.Qxc6+ bxc6 19.Bxa7 is fruitless. Black has three weak pawns to put pressure on after 19...Kc7 18...b6 19.a4!‚","white","","","data_output/extracted_images/diagram_664_page_535.png","535","534","535"
"534","733","Carlsen - Giri","2018","Qf4","Qf4","18. Qf4","18.Qf4 With Black having the weaker king, White should keep the queens on the board. 18.Qg3?! gives Black a change to activate the queen with ...Qe4. Winning a pawn with 18.Qxc6+ bxc6 19.Bxa7 is fruitless. Black has three weak pawns to put pressure on after 19...Kc7 18...b6 19.a4!‚","white","","","data_output/extracted_images/diagram_665_page_535.png","535","534","535"
"535","734","Anand - Giri","2019","Ne1","Ne1+/-","23. Ne1+/-","23.Ne1+/- Redirecting the knight to d3, where it controls the c5-square and leaves the f-pawn free to advance with f2-f4.","white","","","data_output/extracted_images/diagram_666_page_535.png","535","535","535"
"536","735","Karjakin - Carlsen","2019","Qc8","Qc8!","23... Qc8!","23...Qc8!© Keeping the queens, as all Black’s minor pieces point towards the kingside. The plan is ...Bg4 to gain control over the f3-square. Karjakin was soon in deep trouble. He should have given back the pawn with 24.Qd1 Nxc4, with approximate equality.","black","","","data_output/extracted_images/diagram_667_page_536.png","536","536","536"
"536","736","Carlsen - So","2019","Rb1","Rb1!","27. Rb1!","27.Rb1! The b6-pawn is a great weakness, but not if White exchanges rooks. 27...Rb8 28.Ng2² The knight is heading towards d5.","white","","","data_output/extracted_images/diagram_668_page_536.png","536","536","537"
"537","737","Anand - Caruana","2019","h6","h6²","22. h6²","22.h6² Weakening the kingside, whether Black allows h6xg7 or plays ...g7-g6.","white","","","data_output/extracted_images/diagram_669_page_538.png","538","537","538"
"537","738","Carlsen - Aronian","2019","h6","h6²","22. h6²","22.h6² Weakening the kingside, whether Black allows h6xg7 or plays ...g7-g6.","white","","","data_output/extracted_images/diagram_670_page_538.png","538","537","538"
"538","739","Anand - Kasparov","2021","Na2","Na2!","16. Na2!","16.Na2!+/- Keeping the a-file closed is necessary to halt Black’s attack. 16.bxa5? allows: 16...b4µ; 16.Nb1? is also bad in view of: 16...axb4 17.axb4 Qa1µ","white","","","data_output/extracted_images/diagram_671_page_538.png","538","538","538"
"541","740","Steinitz - Strauss","1860","e5","e5!","15. e5!","15.e5! Opening the position before Black has castled. 15...Nd5 15...dxe5?? 16.Bxf7+ is a tactical shot. 16.exd6 0-0 Black is forced to defend g7, which means that White has regained one of the sacrificed pawns. Black opted to give up the g7-pawn with 16...cxd6? in the game, but may have regretted it after his king was chased around the board and eventually mated. 17.Qb3 c6 18.Qg3 f6 19.Rac1+/- The strong pawn on d6 and the active bishops more than compensate for Black’s extra pawn.","white","","","data_output/extracted_images/diagram_672_page_541.png","541","541","541"
"541","741","Steinitz - Robey","1862","d5","d5!","15... d5!","15...d5!÷ Striking in the centre before White has time for g2-g4-g5. 15...Rb8 was played in the game, when 16.g4! would have been best. 16.Nxd5 16.exd5? e4µ opens things up with White’s king in the centre. 16.g4 can be met in two ways: 16...d4 17.cxd4 Qb4+ with unclear counterplay; or 16...dxe4 17.dxe4 Nb7 18.g5 Rfd8 19.Qe2 Ne8 and Black is better developed, even though 20.f6!?÷ looks scary. 16...Nxd5 17.exd5 Nb7÷","black","","","data_output/extracted_images/diagram_673_page_541.png","541","541","542"
"542","742","Blackburne - Steinitz","1862","c5","c5!","22... c5!","22...c5! Freeing the bishop on b6 before it’s too late. Steinitz played 22...Rad8? but would have had great problems after 23.Qc2!+- when Black’s extra pawn is of no help at all. 22...g6? 23.a4 a5 24.Ba3+- is also great for White. 23.Rg4 23.dxc5 Qxb2 24.cxb6 axb6³ Black is still a pawn up and threatens to activate the rook on the a-file. 23.Nf4 threatens Nh5 with a fork, but 23...Rhg8³ defends. 23...Rhg8 24.Ng3 cxd4 25.Rg1 g5÷","black","","","data_output/extracted_images/diagram_674_page_543.png","543","542","543"
"542","743","Blackburne - Steinitz","1863","c5","c5!","22... c5!","22...c5! Freeing the bishop on b6 before it’s too late. Steinitz played 22...Rad8? but would have had great problems after 23.Qc2!+- when Black’s extra pawn is of no help at all. 22...g6? 23.a4 a5 24.Ba3+- is also great for White. 23.Rg4 23.dxc5 Qxb2 24.cxb6 axb6³ Black is still a pawn up and threatens to activate the rook on the a-file. 23.Nf4 threatens Nh5 with a fork, but 23...Rhg8³ defends. 23...Rhg8 24.Ng3 cxd4 25.Rg1 g5÷","black","","","data_output/extracted_images/diagram_675_page_543.png","543","542","543"
"543","744","De Vere - Steinitz","1865","d5","d5!","7... d5!","7...d5! 7...Be7? allowed 8.d5+/- in the game. 8.dxc5 dxc4 Black is not losing a piece on the e-file: 9.Qe2 Qe7 and the knight can move if needed.","black","","","data_output/extracted_images/diagram_676_page_543.png","543","543","544"
"544","745","Steinitz - Anderssen","1866","Ng3","Ng3!","14. Ng3!","14.Ng3! To stop Black from playing ...fxe4 followed by ...Bf5. Anderssen’s 14.Rc1 allowed: 14...fxe4 15.Bxe4 Bf5!=; 14.Qc2 also fails to stop Black’s idea: 14...fxe4 15.Bxe4 Bf5= 14...fxe4 15.Bxe4+- The knight on g3 stops Black from exchanging the active bishop on e4. 15...Bf5? doesn’t work. 15...Nc4 16.Bxh7+ wins a pawn. 16.Nxf5 Nxf5 17.Qd3 Qd7 18.Ng5! and Black soon loses material.","white","","","data_output/extracted_images/diagram_677_page_545.png","545","544","545"
"544","746","Anderssen - Steinitz","1866","Ng3","Ng3!","14. Ng3!","14.Ng3! To stop Black from playing ...fxe4 followed by ...Bf5. Anderssen’s 14.Rc1 allowed: 14...fxe4 15.Bxe4 Bf5!=; 14.Qc2 also fails to stop Black’s idea: 14...fxe4 15.Bxe4 Bf5= 14...fxe4 15.Bxe4+- The knight on g3 stops Black from exchanging the active bishop on e4. 15...Bf5? doesn’t work. 15...Nc4 16.Bxh7+ wins a pawn. 16.Nxf5 Nxf5 17.Qd3 Qd7 18.Ng5! and Black soon loses material.","white","","","data_output/extracted_images/diagram_678_page_545.png","545","544","545"
"545","747","De Vere - Steinitz","1867","Ne8","Ne8!","15... Ne8!","15...Ne8! Defending c7 while keeping everything else protected. 15...Nxe5 16.Bxe5 d6+/- gives Black problems with the f5-pawn, since the d-pawn no longer defends e6. 15...c6? should also be avoided due to: 16.d6+/- 16.Nd3 Bxb2 Steinitz played 16...e5 but he should have exchanged bishops, as it wins time and forces White’s knight to retreat. 17.Nxb2 Ng5³ Black has good attacking chances.","black","","","data_output/extracted_images/diagram_679_page_545.png","545","545","546"
"546","748","Steinitz - Hamel","1867","d5","d5!","8. d5!","8.d5! Making it difficult for Black to move the c- and e-pawns, while preparing Qd4-a4+. 8...0-0-0 9.Qd4! There is no check on a4, but the queen move is still strong, as Black can’t defend the a7-pawn in a good way. For example: 9...Kb8? 9...e5!? is the best chance to prolong the game, sacrificing a pawn to get the queens off. 10.Nb5 b6 11.Qa4 Kb7 12.Nxc7!+- It’s no surprise that White has a tactical blow, but you didn’t need to foresee it when deciding on 8.d5.","white","","","data_output/extracted_images/diagram_680_page_546.png","546","546","546"
"546","749","Steinitz - Dufresne","1874","Nxg5","Nxg5!","16. Nxg5!","16.Nxg5! Sacrificing a piece to get closer to Black’s king. There is no other good way to cope with Black’s threats against e4 and g3. 16.gxf4 runs into 16...fxe4 17.Bc2 Qe6µ when Black wins a piece anyway. (17...Be6³ is also good.) 16...Qxg5 17.Bxf4 Qg6 Following the previous sacrifice, the positional part of this exercise is to evaluate the current position. White is a piece down but the black king is unsafe, and the a8-rook will take quite some time to get into the game. White has easy moves available to develop the initiative. Calculation does not give a clear verdict, but if you’ve seen similar positions you can use your intuition. 18.Qh4+ Nce7 19.Bg5 Qf7 White needs to play actively to develop the attack. The best way is to invite the rook to the party with: 20.Nxe7 Nxe7 21.Rf1!+/-","white","","","data_output/extracted_images/diagram_681_page_547.png","547","546","547"
"547","750","Steinitz - Sellman","1885","d4","d4!","14... d4!","14...d4! Black gives a pawn to open the b7-h1 diagonal, and stops White from easily controlling the dark squares. There are other less exact ways to play the same kind of pawn sacrifice. 14...f5? is described by Kasparov as: “Essentially the decisive positional mistake: Black leaves himself without counterplay.” One possible line is: 15.Qf2 Bb7 16.0-0 0-0 17.Qxd4 Rfd8©","black","","","data_output/extracted_images/diagram_682_page_548.png","548","547","548"
"548","751","Steinitz - Zukertort","1886","Qe3","Qe3!","16. Qe3!","16.Qe3! Moving to d4 to provoke another weakness. 16...d5 16...Qb6 17.Nf6+!+-; 16...Bf8 is not","white","","","data_output/extracted_images/diagram_683_page_548.png","548","548","548"
"549","752","Zukertort - Steinitz","1886","c4","c4","21. c4","21.c4 Chasing away the centralized knight and using the advantage of a hanging pawn couple: covering squares. Zukertort played 21.Bxd5? Rxd5 22.c4³ probably with the idea that the knight was more active than Black’s bishop. However, with hanging pawns White wants to keep as many minor pieces on the board as possible. 21...Nf6 The position is easier to play with White, but Black should be okay. 21...Nf4 is about the same.","white","","","data_output/extracted_images/diagram_684_page_549.png","549","549","549"
"549","753","Steinitz - Zukertort","1886","Rc8","Rc8!","32... Rc8!","32...Rc8!÷ Keeping the knight on d5. It’s hard for White to make cxd5 a threat. The queen and the king need to move, and the latter doesn’t want to be on the b-file. The game continued 32...bxc4 33.Qxc4 Rb8 34.Rd2+/- and Black had no active follow-up.","black","","","data_output/extracted_images/diagram_685_page_550.png","550","549","550"
"551","756","Steinitz - Chigorin","1889","Bc3","Bc3!","16. Bc3!","16.Bc3! Keeping the bishop. White will be in time to defend the f4-pawn. 16.Nxb6 allowed 16...Nxd2 17.Rxd2 axb6³ when the f4-pawn will fall. 16...c6 16...Nxf4 tries to trick White. There are many decent replies, but the strongest is: 17.Rg3!! Nxd5 18.exd5 Nd4 19.Kd2+/- The bishop pair and centre are more important than Black’s extra pawn. 17.Nxb6 axb6 18.Rf2+/-","white","","","data_output/extracted_images/diagram_686_page_551.png","551","551","552"
"552","757","Chigorin - Steinitz","1889","dxe5","dxe5!","22. dxe5!","22.dxe5! The natural capture, gaining the d4-square for the knight. Black will have a hard time defending the queenside pawn. The game ended abruptly with: 22.Qxa5?? Nxf3+ 22...Ng4 23.Qxa5 bxa5 24.Re1+/- White’s next moves are likely to be Nd4, h2-h3 (possibly with g2-g4 afterwards) and Ra1.","white","","","data_output/extracted_images/diagram_687_page_553.png","553","552","553"
"552","758","Bird - Lasker","1890","dxe5","dxe5!","22. dxe5!","22.dxe5! The natural capture, gaining the d4-square for the knight. Black will have a hard time defending the queenside pawn. The game ended abruptly with: 22.Qxa5?? Nxf3+ 22...Ng4 23.Qxa5 bxa5 24.Re1+/- White’s next moves are likely to be Nd4, h2-h3 (possibly with g2-g4 afterwards) and Ra1.","white","","","data_output/extracted_images/diagram_688_page_553.png","553","552","553"
"553","759","Steinitz - Chigorin","1890","f4","f4!","17. f4!","17.f4!² Stopping ...f5-f4. The game continued 17.Nc3?! Be6 18.b3?! Bb4 19.Bb2 f4 and Black had","white","","","data_output/extracted_images/diagram_689_page_553.png","553","553","553"
"554","760","Bird - Lasker","1892","Nxf2","Nxf2!","10... Nxf2!","10...Nxf2! 10...e4 11.hxg4 exd3 allowed White to keep the position closed with 12.g5! (which was not played). 11.Kxf2 Bc5+µ Black gets the piece back with White’s king in the centre. (White will be a pawn up, just as in the initial position.)","black","","","data_output/extracted_images/diagram_690_page_554.png","554","554","554"
"554","761","Blackburne - Lasker","1892","d5","d5!","8... d5!","8...d5! Both this and ...Re8 are natural moves, and it’s often best to start with the most active. Black threatens to move the pawn another step. 8...Re8 9.Qf2 d5 10.Bg5÷ 9.Qc5 9.exd5 Nxd5µ opens the diagonal for the g7-bishop. (9...Nb4µ is also good.) 9...d4µ 9...dxe4?! was played.","black","","","data_output/extracted_images/diagram_691_page_554.png","554","554","555"
"555","762","Steinitz - Lasker","1894","0-0","0-0!","9. 0-0!","9.0-0! Developing is more important than keeping material equal. White now threatens to take on d5, so Black has no time to castle. 9...Be6 9...Nxc3 10.bxc3 Bxc3 11.Qb3! A double threat. 11...Bxa1 12.Bxf7+ Kf8 13.Ba3+ Ne7 14.Rxa1+- The pin is decisive. 10.Re1! Strongest. 10.Bg5!?+/- was the game. 10...0-0 No better is: 10...Nxc3 11.bxc3 Bxc3 12.Bg5 Qd6 13.d5+- 11.Ng5 Nxc3 12.Qd3! Followed by Nxe6 with a decisive advantage.","white","","","data_output/extracted_images/diagram_692_page_556.png","556","555","556"
"556","764","Lasker - Chigorin","1896","f4","f4!","19... f4!","19...f4! Black defends against Bxh6 with tempo, which is important as it gives Black time to release the bishop on c8. 19...Qh4 was played, when 20.Re1+/- would have ended Black’s dream of activating the bishop. 20.Rf3 Other rook moves are met in a similar way. 20...e5! 21.dxe5 Qxd3 22.cxd3 g5©","black","","","data_output/extracted_images/diagram_693_page_556.png","556","556","557"
"557","765","Lasker - Levitsky","1896","Na4","Na4!","20. Na4!","20.Na4!+/- Controlling the dark squares. Exchanging on b6 would have repaired Black’s structure.","white","","","data_output/extracted_images/diagram_694_page_557.png","557","557","557"
"557","766","Schiffers - Steinitz","1896","Bxf7","Bxf7+!","10. Bxf7+!","Defending/retreating the knight allows Black to take back material with ...Qxc3. White would still be clearly better with the bishop pair, but there is an even stronger way to play. 10.Bxf7+! Rxf7 11.Nxf7 Kxf7 12.c4+/- Black’s pieces won’t find good squares.","white","","","data_output/extracted_images/diagram_695_page_557.png","557","557","558"
"558","767","Schiffers - Steinitz","1896","dxe5","dxe5!","20... dxe5!","20...dxe5! Black gets a great initiative on the kingside. Threatening the pawn on a3 wins a tempo. 20...Nxe5 21.f4= 21.Nb5 Qg5µ ...e5-e4 and ...f5-f4 are on the way.","black","","","data_output/extracted_images/diagram_696_page_559.png","559","558","559"
