"page","diagram_number","players","year","solution_move","solution_move_with_notation","solution_full_move","solution_full_text","solution_turn","fen","api_turn","image_path","image_page","header_page","solution_page"
"192","236","Kramnik - Anand","2005","Ng6","Ng6","12... Ng6","12...Ng6 Often the best placement for the knight in the Berlin endgame. The knight avoids obstructing the light-squared bishop, and at the same time makes it harder for White to prepare Nd4 and f2-f4 (as the e5-pawn would be hanging). Black will continue developing with ...Bb4 or ...Be7, and will then prepare to exchange a pair of rooks with ...Rd8. 12...Be6 13.Nd4+/-; A test solver noted 12...a5 13.a3 Ng6 14.Nd4 Nxe5 15.Bf4 Nc4 16.Ndb5!!+/- as an argument for not starting with 12...a5. A better argument is that we should develop pieces before pawns, unless there’s a truly compelling reason not to.","black","","","data_output/extracted_images/diagram_221_page_193.png","193","192","193"
"193","237","Karpov - Zechner","2005","c5","c5!","17. c5!","17.c5! Forcing Black to part with the bishop, and at the same time stopping ...c6-c5 forever. 17.b4 is a decent move, with the idea to meet 17...c5 with: 18.dxc5 bxc5 19.b5+/- 17...Bxe5 17...bxc5 18.dxc5 Bxc5 19.Ng6+- 18.Bxe5 Qd7 If 18...Qd8 19.f4+- White’s attack should decide the outcome, as Black is essentially a piece down. 19.Bxf6 gxf6 20.Qg4+ Kh8 Surprisingly, Karpov opted to force a draw by repetition. In a serious competition he would surely have played for (and most likely obtained) the win. One good method is: 21.Qf4 The game ended: 21.Qh5 Kg7 22.Qg4+ Kh8 23.Qh5 Kg7 24.Qg4+ Kh8 1/2-1/2 21...Kg7 22.Rfd1+- Intending to transfer the other rook to the kingside via the third rank.","white","","","data_output/extracted_images/diagram_222_page_194.png","194","193","194"
"194","238","Leko - Topalov","2005","Bxd5","Bxd5!","14. Bxd5!","14.Bxd5! Rather than losing a tempo by moving the bishop, White opens up by exchanging. 14...Nxd5 15.Rhe1 Bb7 16.Qe2! Threatening to sacrifice on e6. 16...Qd6 17.f4!+- The most direct and powerful. 17.Kb1+/- was the game continuation.","white","","","data_output/extracted_images/diagram_223_page_195.png","195","194","195"
"195","239","Adams - Anand","2005","Bg5","Bg5","16... Bg5","16...Bg5 Activating the passive bishop is correct, even though White can (and should) avoid the","black","","","data_output/extracted_images/diagram_224_page_195.png","195","195","195"
"196","240","Yemelin - Karpov","2006","b6","b6!","8... b6!","8...b6! Challenging White’s pawn before it’s properly defended. 9.b4 9.cxb6 Qxb6³ 9...a5 9...bxc5? 10.bxc5+/- 10.Na4! The only way to avoid a collapse. 10...axb4 10...Nbd7 allows 11.b5 with the c5- pawn still protected. 11.Nxb6 Ra5! Karpov played 11...Ra7 but the text move is stronger. Black develops actively and will exert pressure on the a2-, c5- and d4-pawns. For example: 12.Nxc8 Or 12.Bd3 Ba6 13.0-0 Bxd3 14.Qxd3 Ne4³ threatening 15...Bxc5. 12...Qxc8 13.Bd3 Nc6 14.0-0 Qa8³","black","","","data_output/extracted_images/diagram_225_page_196.png","196","196","196"
"196","241","Gustafsson - Anand","2006","c5","c5!","5... c5!","5...c5!= 5...Nbd7 is another way of playing. In some ways the choice is a matter of taste, but I included it as an exercise since there’s no better moment to go for the Tarrasch approach with an isolated pawn. One reason is that the knight on d2 does not exert pressure on d5, and would be better on c3. The fact that White has committed to e2-e3 also helps Black in two ways: it prevents the c1- bishop from going to g5, and it means that the f1-bishop is likely heading for e2 rather than g2. (The kingside fianchetto is considered optimal against the IQP structure, as it fortifies the kingside while enabling the bishop to exert pressure against d5.)","black","","","data_output/extracted_images/diagram_226_page_197.png","197","196","197"
"197","242","Anand - Almasi","2006","h5","h5","14... h5","14...h5 Prophylaxis against g2-g4. (It’s not clear if it was an immediate threat, but Black could not ignore it for much longer.) A test solver argued that 14...b6 is “as good”, but I disagree. The computer may not indicate much of a difference, but from a human perspective Black’s first priority should be the kingside.","black","","","data_output/extracted_images/diagram_227_page_198.png","198","197","198"
"198","243","Kramnik - Caen University","2006","Ba3","Ba3!","11. Ba3!","11.Ba3!² Exchanging the black bishop that controls e5. 11...Bxa3 In the event of 11...Nbd7 12.Bxd6 Qxd6 White might, in the long run, manoeuvre with Nc3-e2-f4-d3. 12.Nxa3² 12.Qxa3 is not so logical with Black’s king still in the centre.","white","","","data_output/extracted_images/diagram_228_page_198.png","198","198","199"
"199","244","Kramnik - Aronian","2006","Nd5","Nd5!","18. Nd5!","18.Nd5! Threatening to take on f6. 18.cxb5 axb5 19.Qb4 Rb7² 18...Nxd5 In the event of 18...Qd8 19.Bxf6 Bxf6 20.Nxf6+ exf6 White has some pressure on the d-file, but mainly a dangerous plan with 21.Qh6+/- followed by Rd4-h4. 19.cxd5 Black is not in time to defend e7 and fight for the c-file. 19...Rc7 20.Rc6+/- Or simply: 20.Bxe7+-","white","","","data_output/extracted_images/diagram_229_page_199.png","199","199","199"
"199","245","Vallejo Pons - Topalov","2006","Nf1","Nf1!","14. Nf1!","14.Nf1! Preventing the positional threat of ...d6-d5, while preparing Ne3 followed by a timely occupation of d5 or perhaps f5.","white","","","data_output/extracted_images/diagram_230_page_200.png","200","199","200"
"200","246","Ponomariov - Bologan","2006","f4","f4!","16. f4!","16.f4! Black’s pawn duo e5-f5 is halted. 16.f3? f4 17.Bf2 h3 and White’s king is weak. 16.Bh6?! Bxh6 17.Qxh6 Qf6³ 16...exf4 16...b5² 17.Bxf4 Ne5 Black has an active knight but weak pawns.","white","","","data_output/extracted_images/diagram_231_page_200.png","200","200","200"
"201","247","Polgar - Topalov","2006","f5","f5!","18. f5!","18.f5! Forcing Black to part with the bishop. 18...gxf5 19.exf5 Bc4 20.Nxc4 bxc4 21.Be4 21.Be2 is also good. 21...Nxe4 22.Nxe4 Nf6 White dominates the light squares. A good way to continue would have been: 23.Nxf6+ Bxf6 24.Ba7 Qc7 25.Rd5+-","white","","","data_output/extracted_images/diagram_232_page_202.png","202","201","202"
"201","248","Karjakin - Topalov","2007","f5","f5!","18. f5!","18.f5! Forcing Black to part with the bishop. 18...gxf5 19.exf5 Bc4 20.Nxc4 bxc4 21.Be4 21.Be2 is also good. 21...Nxe4 22.Nxe4 Nf6 White dominates the light squares. A good way to continue would have been: 23.Nxf6+ Bxf6 24.Ba7 Qc7 25.Rd5+-","white","","","data_output/extracted_images/diagram_233_page_202.png","202","201","202"
"202","249","Karpov - Marin","2007","Be2","Be2!","14. Be2!","14.Be2! Black can’t avoid the upcoming Bxh5. However, retreating the bishop to e2 would have been","white","","","data_output/extracted_images/diagram_234_page_202.png","202","202","202"
"203","250","Carlsen - Aronian","2007","d5","d5!","19... d5!","19...d5!= It’s generally a good idea to get rid of the slightly weak d6-pawn, provided White is unable to achieve anything concrete from the opening of the centre. 19...e5? 20.Nh4+/-; 19...Qb8 20.h3²","black","","","data_output/extracted_images/diagram_235_page_203.png","203","203","203"
"204","251","Carlsen - Anand","2007","b4","b4!","13. b4!","13.b4! With this move White fixes the pawn on b5, thus preparing a3-a4 without allowing ...b5-b4 in reply. White may also be happy to develop the bishop to b2, eyeing the slightly weak e5-pawn. 13.a4?! b4= is fine for Black. 13...Rfd8 13...a5 14.Bb2 threatens a3-a4, and if 14...a4? 15.c4! Black’s centre collapses. 14.Rd1 Defending the d3-square. 14...dxe4 Aronian tries to be active, but it doesn’t lead anywhere. 15.Nxe4 Nxe4 16.Qxe4 Qd5 17.Bb2²","white","","","data_output/extracted_images/diagram_236_page_205.png","205","204","205"
"204","252","Anand - Aronian","2007","b4","b4!","13. b4!","13.b4! With this move White fixes the pawn on b5, thus preparing a3-a4 without allowing ...b5-b4 in reply. White may also be happy to develop the bishop to b2, eyeing the slightly weak e5-pawn. 13.a4?! b4= is fine for Black. 13...Rfd8 13...a5 14.Bb2 threatens a3-a4, and if 14...a4? 15.c4! Black’s centre collapses. 14.Rd1 Defending the d3-square. 14...dxe4 Aronian tries to be active, but it doesn’t lead anywhere. 15.Nxe4 Nxe4 16.Qxe4 Qd5 17.Bb2²","white","","","data_output/extracted_images/diagram_237_page_205.png","205","204","205"
"205","253","Karpov - Levitov","2007","Nb5","Nb5","19... Nb5","19...Nb5 Exchanging the defender of the a2-pawn while opening the g7-a1 diagonal. Black is generally happy to exchange minor pieces. 20.Nxb5 After 20.a4 Black can take on c3, but another option is: 20...Nd4 21.Nxd4 cxd4 22.Nb5 Qb7!³ The last move prepares ...Nc5 by ensuring that b2- b4xc5 will not hit the queen. 20...Qxb5 21.a3 Rb6©","black","","","data_output/extracted_images/diagram_238_page_205.png","205","205","206"
"206","254","Drazic - Karpov","2007","Ka1","Ka1²","20. Ka1²","20.Ka1² Keeping the pawn to hide behind. White’s attack with g4-g5 and f5-f6 has more potential than Black’s. 20.Kxa2? Qa5+ 21.Kb1 Rb8-+","white","","","data_output/extracted_images/diagram_239_page_207.png","207","206","207"
"206","255","Nisipeanu - Topalov","2007","Ka1","Ka1²","20. Ka1²","20.Ka1² Keeping the pawn to hide behind. White’s attack with g4-g5 and f5-f6 has more potential than Black’s. 20.Kxa2? Qa5+ 21.Kb1 Rb8-+","white","","","data_output/extracted_images/diagram_240_page_207.png","207","206","207"
"207","256","Kramnik - Leko","2007","c5","c5","18... c5","18...c5 Exchanging a backward pawn and activating the rook on a7. There is no other move to consider, so we don’t need an evaluation.","black","","","data_output/extracted_images/diagram_241_page_207.png","207","207","207"
"208","257","Savchenko - Anand","2007","Nh7","Nh7!","14... Nh7!","14...Nh7! The best way to handle g4-g5, which White nevertheless is forced to play as the h4-pawn is hanging. 14...h5!? 15.gxh5 d5 is okay (better) for Black according to the engine, but 16.h6÷ still looks shaky for Black’s king. 15.g5 15.h5 is positionally lost for White. 15...hxg5 16.hxg5 Bxg5 The time control must be the explanation why Anand chose to keep the bishops with 16...Nxg5?. After 17.Qg4 f6 18.Be3+/- there is no doubt as to which bishop is best. 17.Bxg5 Nxg5 Black continues with ...f7-f6, avoiding any mate on the h-file as the king has an escape square.","black","","","data_output/extracted_images/diagram_242_page_208.png","208","208","208"
"208","258","Kramnik - Carlsen","2007","b4","b4!","15. b4!","15.b4! Stopping Black from executing the pawn lever that would exchange his weak pawn and open the file for his rook15...a5 16.Ne5! 16.Rfb1 axb4 17.axb4 Nd5 gives counterplay. 16...Nd5?! The game continues in Exercise 943. 16...Bxg2 17.Kxg2 c6² was a better defensive try.","white","","","data_output/extracted_images/diagram_243_page_209.png","209","208","209"
"209","259","Kramnik - Anand","2007","b4","b4!","19. b4!","19.b4! White’s entire strategy has been based on stopping ...c7-c5. His next plan is to double up on","white","","","data_output/extracted_images/diagram_244_page_209.png","209","209","209"
"210","260","Anand - Topalov","2008","Bh6","Bh6!","13... Bh6!","13...Bh6!= Exchanging the bishop pair.","black","","","data_output/extracted_images/diagram_245_page_210.png","210","210","210"
"210","261","Kramnik - Navara","2008","Bg5","Bg5!","14. Bg5!","14.Bg5! Threatening Bxc6. 14...f6 After 14...Qc7 the knights defend each other, but Black’s position is shaky. 15.Na4! is interesting (but not the only good move). 15...b5 (15...f6 16.Bd2²) 16.Nxc5 bxc4 17.Nxe6 fxe6 18.Bxe7 Nxe7 19.Bxa8 Rxa8 20.Rc1 Qb6 21.dxc4 Qxb2 22.c5² 15.Be3 By inducing ...f7-f6, White has reduced the scope of the g7-bishop and opened the diagonal leading towards Black’s king. No further lines are needed, but let’s see one anyway: 15...b6 16.Qa4 Bd7? This would be a good move if the pawn was still on f7, but here it loses to 17.Qb3! with a double threat thanks to ...f7-f6.","white","","","data_output/extracted_images/diagram_246_page_211.png","211","210","211"
"211","262","Ivanchuk - Anand","2008","Bc4=","Bc4=","12... Bc4=","12...Bc4= 12...Bxb3?! 13.cxb3!² opens up the c-file in White’s favour - Black was supposed to exert pressure along this file.","black","","","data_output/extracted_images/diagram_247_page_212.png","212","211","212"
"212","263","Kramnik - Leko","2008","d5","d5!","6. d5!","6.d5! Not allowing Black to get a Hedgehog. 6.Bg2 allows 6...Nc6. 6...exd5 7.cxd5 Bb7 8.Bg2 8.e4 Qe7 9.Bg2 is another way to sacrifice the pawn, but allowing a queen exchange is less critical.","white","","","data_output/extracted_images/diagram_248_page_212.png","212","212","212"
"213","264","Polgar - Anand","2008","Nbd7","Nbd7","9... Nbd7","9...Nbd7 The knight almost always belongs on d7 rather than c6 in this structure. The main advantages are that the c-file is kept open for the rook and, in the event of an exchange on f6, Black can recapture with the knight to maintain control over d5. Moreover, ...Nb6-c4 is an attractive possibility in some lines. (...Nc6-a5-c4 would be less threatening due to the possibility of Nxa5.) A quick search shows that in games between strong players, the knight is developed to d7 in 90% of the games. Does anyone want to argue with decades of experience? Not even Stockfish. 9...0-0 may be okay, but it gives White the option of 10.Bxf6!? with increased control over the d5-square.","black","","","data_output/extracted_images/diagram_249_page_213.png","213","213","213"
"213","265","Ivanchuk - Kramnik","2008","g4","g4!","14. g4!","14.g4! White wants to use the pawn majority on the kingside, if the pawns are not too weak after an immediate ...h7-h5. That’s not going to happen with Black’s knight on h6. 14.Rd3 Rhd8³ 14...c5! A pawn sacrifice is the best chance. The game went 14...Nh6?! when White is positionally dominating, though still a long way from winning the game. 15.Nd5+ 15.Rd5!? also wins a pawn: 15...Nh6 16.Rad1 Rhd8 17.Rxd8 Rxd8 18.Rxd8 Kxd8 19.Ng5 Black is unable to defend h7. 15...Bxd5 16.Rxd5 Ke6 17.Rd2 Nd4 Black has good drawing chances.","white","","","data_output/extracted_images/diagram_250_page_214.png","214","213","214"
"214","266","Anand - Wang Yue","2009","f4","f4!","15. f4!","15.f4! Stopping ...e6-e5. Only this move is needed to solve the exercise. 15...b6 16.a3 16.g4!? is a logical alternative suggested by some test solvers. 16...a5 17.Qc2 Qb7² Black will continue with ...Bc7 followed by rook exchanges on the a-file. This should stop White’s kingside attack from becoming too dangerous, but Black is still on the defensive.","white","","","data_output/extracted_images/diagram_251_page_214.png","214","214","215"
"215","267","Ponomariov - Bareev","2009","f5","f5!","30... f5!","30...f5! To activate the bishop. 31.exf5? 31.Re2?! fxe4 32.fxe4 Rd4µ; 31.Nd2!= was the best way to fight against the bishop. 31...e4 32.fxe4? Losing, but White was in trouble anyway. 32...Qxe4+ 33.Kh3 Rd4 Black is winning. Anand’s next moves were instructive: 34.Ne3 Qe8! 35.g4 h5!-+","black","","","data_output/extracted_images/diagram_252_page_216.png","216","215","216"
"215","268","Topalov - Anand","2010","f5","f5!","30... f5!","30...f5! To activate the bishop. 31.exf5? 31.Re2?! fxe4 32.fxe4 Rd4µ; 31.Nd2!= was the best way to fight against the bishop. 31...e4 32.fxe4? Losing, but White was in trouble anyway. 32...Qxe4+ 33.Kh3 Rd4 Black is winning. Anand’s next moves were instructive: 34.Ne3 Qe8! 35.g4 h5!-+","black","","","data_output/extracted_images/diagram_253_page_216.png","216","215","216"
"216","269","Kramnik - Grischuk","2011","b5","b5!","11... b5!","11...b5! The move Black wants to play in the Benoni. Black should not start with 11...h6?! 12.Be3 as","black","","","data_output/extracted_images/diagram_254_page_216.png","216","216","216"
"217","270","Vitiugov - Khalifman","2011","Kf1","Kf1!","12. Kf1!","12.Kf1! The strong pawn centre would be less valuable without queens. Yes, White would have preferred to castle, but the rook can still become useful on the h-file after h2-h4. 12...b6 13.Qe2!²","white","","","data_output/extracted_images/diagram_255_page_217.png","217","217","217"
"217","271","Giri - Ponomariov","2011","cxb5","cxb5!","21... cxb5!","21...cxb5! 21...axb5 22.axb5 Nbc4 23.bxc6 bxc6² reaches a position where it’s hard for White to win, but the weak c6-pawn will be there for a long time. 22.axb5 22.a5 Nbc4 23.Nxd5 Qf7³ Black controls the most important light squares. 22...a5 White has not achieved anything on the queenside; the a-pawn is more strong than weak. 23.Nd2 Black could now have prevented e3-e4 at the price of a weak e5-square. 23...f5!?÷ 23...a4 24.e4÷","black","","","data_output/extracted_images/diagram_256_page_218.png","218","217","218"
"218","272","Carlsen - Aronian","2012","f3","f3!","14. f3!","14.f3!² Mobilizing the central pawns. 14.Rad1 is a decent move but puts less pressure on Black. One difference is 14...a4 15.f3 b5 16.e4 b4 when White can’t go to a4 with the knight.","white","","","data_output/extracted_images/diagram_257_page_218.png","218","218","219"
"219","274","Ponomariov - Harikrishna","2012","Bxe6","Bxe6","13. Bxe6","13.Bxe6 13.d4 Bxa2 14.Rxa2 exd4 15.cxd4 c5³ 13...fxe6 Black’s doubled pawns are not weak for the moment, but they are (as usual) making it difficult to advance other pawns without creating weaknesses. For example, White does not have to worry about ...d6-d5 as it would weaken the e5- pawn. Even so, White’s standard reaction after doubling Black’s pawns is to exchange one of them. 14.d4! bxc3 15.bxc3 exd4 16.cxd4+/- Black soon needs to spend energy defending the e6-pawn. With the position opening up, Black’s king would have preferred to have a pawn on f7.","white","","","data_output/extracted_images/diagram_258_page_220.png","220","219","220"
"220","275","Ponomariov - Cheparinov","2012","Nf1","Nf1!","13. Nf1!","13.Nf1!² Heading for e3 to control d5. (Black was threatening ...d6-d5.)","white","","","data_output/extracted_images/diagram_259_page_220.png","220","220","221"
"221","277","Kasimdzhanov - Topalov","2013","c4","c4!","9... c4!","9...c4! White should not castle long before the pawns have been exchanged with dxc5 or ...c5xd4. Black has a self-playing attack9...Qa6 10.Kb1 c4! is an alternative leading to the same type of situation.","black","","","data_output/extracted_images/diagram_260_page_223.png","223","221","223"
"222","278","Ardelean - Khalifman","2013","c4","c4!","9... c4!","9...c4! White should not castle long before the pawns have been exchanged with dxc5 or ...c5xd4. Black has a self-playing attack9...Qa6 10.Kb1 c4! is an alternative leading to the same type of situation.","black","","","data_output/extracted_images/diagram_261_page_223.png","223","222","223"
"223","279","Carlsen - Anand","2013","f3","f3!","19. f3!","19.f3! Making use of the centre pawns. 19.b4?! is unnecessary because Black cannot play ...c6-c5","white","","","data_output/extracted_images/diagram_262_page_223.png","223","223","223"
"224","280","Carlsen - Anand","2013","Nxe6","Nxe6!","24. Nxe6!","24.Nxe6! After 24.exd5 Black can’t recapture on d5, but 24...Bf5! leaves White with only a small advantage. 24...fxe6 25.Bh3+- Black collapses. (A tactical exercise? Well, Bh3 is a standard move.)","white","","","data_output/extracted_images/diagram_263_page_224.png","224","224","224"
"224","281","Khalifman - Predke","2014","c6","c6!","14... c6!","14...c6! Activating the b7-bishop as well as the e7-knight. 14...Bxe3?! 15.Rxe3 helps White’s rook to develop, making it easier to double up in the future. 15.dxc6 Nxc6= Black has plenty of active possibilities, so the backward d6-pawn is no big deal.","black","","","data_output/extracted_images/diagram_264_page_225.png","225","224","225"
"225","282","Kramnik - Giri","2014","e5","e5!","14. e5!","14.e5!+/- White continues with f4-f5 (unless g2-g4 traps the knight). The e4-e5 advance can be","white","","","data_output/extracted_images/diagram_265_page_225.png","225","225","225"
"226","283","Kramnik - Nakamura","2014","gxf5","gxf5","12... gxf5","12...gxf5 Every Russian schoolboy knows that Black must take back with the pawn. Every American superstar as well. 12...Bxf5 13.g4! Bd7 and White’s pieces are better - especially after 14.g5!+/- gaining the g5-square. The following moves are not part of the exercise, but since they are instructive, let’s include them: 13.Qc1! f4! 14.g3! e4! 15.Nh4 e3! 16.fxe3 fxg3 17.Ng6 With a position that’s been discussed a lot in top-level games.","black","","","data_output/extracted_images/diagram_266_page_226.png","226","226","226"
"226","284","Caruana - Anand","2015","c5","c5","14... c5","14...c5 Getting rid of the backward pawn. 15.dxc5 Nxc5³ White’s pieces are misplaced.","black","","","data_output/extracted_images/diagram_267_page_227.png","227","226","227"
"227","285","Topalov - Aronian","2015","Qb4","Qb4!","16. Qb4!","16.Qb4! Before Black has time for ...c7-c5. To avoid losing material Black is forced to exchange queens, which opens the c-file in White’s favour. 16...Qxb4 17.cxb4 Nc6 18.Rab1²","white","","","data_output/extracted_images/diagram_268_page_227.png","227","227","227"
"228","286","Grischuk - Topalov","2015","b4","b4","15... b4","15...b4 Not allowing White to play b3-b4. 15...Qb6 can be included first. 16.Na4 16.Nb5? Qb6 17.Kh1 g5! was the game, and Black soon won a piece. 16...Nxa4 17.Rxa4 a5=","black","","","data_output/extracted_images/diagram_269_page_228.png","228","228","228"
"228","287","Kasparov - Rajkovic","2015","h6","h6!","13... h6!","13...h6! Not allowing h5-h6, which would create eternal weaknesses in Black’s position. After h5-h6","black","","","data_output/extracted_images/diagram_270_page_228.png","228","228","228"
"229","288","Nakamura - Topalov","2016","e4","e4","12... e4","12...e4 This pawn provides the starting ground for an expansion on the kingside. 12...exd4 13.exd4 is usually only advisable when Black can follow up with ...Ne4 soon. 12...0-0 is okay for Black, but less flexible given the choices mentioned at the end of the main line. (This is in contrast to the common scenario where it’s most flexible to start by castling!) 12...b5 13.b4 leaves the pawn on c6 weak, which encourages White to play for e3-e4. In the event of 13...e4 White plays 14.f3 exf3 15.Qxf3² with good chances on the light squares. 13.b4 Now 13.f3? exf3 14.Qxf3 is well met by 14...Nf8 intending ...Ne6-g5. 13...axb4 14.axb4 Nf8 15.b5 Ne6 16.Bd2÷ Black has two major choices to make. Should he castle or keep the rook on the h-file? And should the knight go to g5 quickly, or wait until ...g6-g5-g4 has been played? These decisions are beyond the scope of the exercise; but in any case, White is not playing on the queenside for free.","black","","","data_output/extracted_images/diagram_271_page_229.png","229","229","229"
"229","289","Karjakin - Topalov","2016","Bf6","Bf6!","17... Bf6!","17...Bf6!÷ Defending the king while also having active possibilities in mind. 17...Rc8? was played in the game, and we’ll return to it in Exercise 542. 17...Qc8?! guards e6 but is too passive. The exercise ends here, as White has many possibilities and we can’t realistically expect to calculate all of them. One of many possible continuations is: 18.h6!? fxg6! 19.hxg7 19.Nxe6?! Qe7 20.Nxf8 Bxc3 21.bxc3 Bxe4© is balanced according to the engine, but from a human perspective it’s clearly more dangerous for White. 19...Re8 20.Rh3! The complicated fight continues.","black","","","data_output/extracted_images/diagram_272_page_230.png","230","229","230"
"230","290","Kasparov - Caruana","2016","Ne2","Ne2!","13. Ne2!","13.Ne2! Chasing away the bishop from the defence of the knight. 13...Bxb2 14.Rb1 Ba3 White has two good options here, the strongest being: 15.Bxe6! 15.Bxf6 Qxf6 16.Qxf6 gxf6 17.Rxf6+/- is excellent for White. 15...fxe6 16.d4 Trapping the bishop! A tactical exercise? Well, the first move is a standard one.","white","","","data_output/extracted_images/diagram_273_page_230.png","230","230","231"
"231","291","Kramnik - Sjugirov","2016","c5","c5!","8... c5!","8...c5! Controlling the centre. The move has to be played straight away, as White would otherwise go b2-b4.","black","","","data_output/extracted_images/diagram_274_page_232.png","232","231","232"
"231","292","Kramnik - Carlsen","2016","c5","c5!","8... c5!","8...c5! Controlling the centre. The move has to be played straight away, as White would otherwise go b2-b4.","black","","","data_output/extracted_images/diagram_275_page_232.png","232","231","232"
"232","293","Carlsen - Ghaem Maghami","2016","Bb5","Bb5","9. Bb5","9.Bb5 Playing for the e5-square. 9...Bd7 10.Bxc6 Bxc6 11.Ne5² White doesn’t follow up with f2-f4, but rather with active moves such as Qf3 and/or g3-g4. If the knight needs to be defended, Ndf3 is a","white","","","data_output/extracted_images/diagram_276_page_232.png","232","232","232"
"233","294","Caruana - Anand","2017","e4","e4","12... e4","12...e4 13.Nd2 d5³ Black can slowly prepare an attack on the kingside. Trying to fight back with f2- f3 would weaken White’s position too much.","black","","","data_output/extracted_images/diagram_277_page_233.png","233","233","233"
"233","295","Carlsen - Grigoriants","2017","Qd1","Qd1!","8. Qd1!","8.Qd1!² The only square where the queen isn’t harassed further. Moving the queen two times to end up on the starting square looks odd, but Black has also spent one tempo (...e5xd4) and can’t use the other to open up with ...d7-d5. Without that, White has a favourable structure. White’s next moves are likely to be Nf4, Be2 and 0-0.","white","","","data_output/extracted_images/diagram_278_page_233.png","233","233","234"
